<?xml version="1.0" encoding="UTF-8" standalone="no"?>
<users xmlns:xsi="http://www.w3.org/2001/XMLSchema-instance" xsi:noNamespaceSchemaLocation="registeruserschema.xsd">
 <user>
  <email>anilanil@gmail.com</email>
  <username>anilkumar</username>
  <password>Anil@12345</password>
  <gender>male</gender>
  <dob>2018-10-01</dob>
  <address>asdfgdadffds</address>
  <preferences>ALCATEL</preferences>
  <preferences>APPLE</preferences>
  <nation>india</nation>
 </user>
</users>